{
  "$schema": "https://json-schema.org/draft/2020-12/schema",
  "$id": "https://github.com/chrbailey/saas-rebuild/schemas/extraction-recipe-v0.11.json",
  "title": "Per-app extraction recipe (one file of corpus/extraction-recipes/)",
  "description": "A document-derived route map for an authorized tenant teardown. A recipe is a hypothesis until verified: doc-derived-unverified recipes must be checked against current documentation, entitlements, region, and the live tenant before their claims enter an evidence base. The v0.7 sources array is a recipe-level bibliography, not machine-enforced claim-to-source lineage.",
  "type": "object",
  "additionalProperties": false,
  "required": [
    "schema_version",
    "app",
    "app_name",
    "vendor",
    "category",
    "export_rights",
    "routes",
    "preservation_notes",
    "sources",
    "verification",
    "last_reviewed"
  ],
  "properties": {
    "schema_version": {
      "const": "0.11.0"
    },
    "app": {
      "type": "string",
      "pattern": "^[a-z0-9][a-z0-9-]*$",
      "description": "kebab-case slug, matches the filename and the apps.json entry"
    },
    "app_name": {
      "type": "string"
    },
    "vendor": {
      "type": "string"
    },
    "category": {
      "type": "string",
      "description": "kebab-case category, e.g. crm, erp-finance, hr-payroll, itsm"
    },
    "export_rights": {
      "type": "object",
      "additionalProperties": false,
      "required": [
        "summary"
      ],
      "properties": {
        "summary": {
          "type": "string",
          "description": "what the customer is entitled to export, in one or two sentences, per the vendor's own terms or docs"
        },
        "tos_url": {
          "type": [
            "string",
            "null"
          ],
          "format": "uri",
          "description": "URL of the terms/DPA/export-policy page consulted"
        },
        "post_termination_window": {
          "type": [
            "string",
            "null"
          ],
          "description": "documented data-retrieval window after termination (e.g. '30 days'), null if not documented"
        }
      }
    },
    "routes": {
      "type": "array",
      "minItems": 1,
      "description": "extraction routes in descending preference order",
      "items": {
        "type": "object",
        "additionalProperties": false,
        "required": [
          "route_type",
          "covers",
          "how"
        ],
        "properties": {
          "route_type": {
            "enum": [
              "account-export",
              "entity-export",
              "report-builder",
              "api",
              "bulk-api",
              "backup-integration",
              "file-storage",
              "audit-log-export",
              "config-export",
              "scrape-last-resort"
            ],
            "description": "account-export: whole-tenant/backup export. entity-export: per-entity CSV/XLSX from the UI. config-export: metadata/customization artifacts (SDF, Metadata API packages)"
          },
          "covers": {
            "type": "array",
            "minItems": 1,
            "items": {
              "type": "string"
            },
            "description": "entities or artifact kinds this route extracts, e.g. contacts, invoices, attachments, audit-log, workflow-definitions"
          },
          "how": {
            "type": "string",
            "description": "concrete steps or endpoint, compressed: nav path for UI routes, endpoint + auth style for APIs"
          },
          "formats": {
            "type": "array",
            "items": {
              "type": "string"
            }
          },
          "requires": {
            "type": "array",
            "items": {
              "type": "string"
            },
            "description": "role, plan/SKU, API token type, or vendor ticket this route needs"
          },
          "rate_limits": {
            "type": [
              "string",
              "null"
            ]
          },
          "gotchas": {
            "type": "array",
            "items": {
              "type": "string"
            },
            "description": "field truncation, attachments not included, pagination caps, silent export failures"
          }
        }
      }
    },
    "preservation_notes": {
      "type": "object",
      "additionalProperties": false,
      "description": "the Phase 4b checklist items that need app-specific answers; null means the docs don't say — verify in-tenant",
      "required": [
        "attachments",
        "audit_log",
        "config_artifacts"
      ],
      "properties": {
        "attachments": {
          "type": [
            "string",
            "null"
          ],
          "description": "how files/attachments/documents are bulk-extracted, or null if undocumented"
        },
        "audit_log": {
          "type": [
            "string",
            "null"
          ],
          "description": "how the audit/activity log is exported and its documented retention"
        },
        "config_artifacts": {
          "type": [
            "string",
            "null"
          ],
          "description": "how customizations (fields, workflows, reports) export as restorable artifacts"
        }
      }
    },
    "sources": {
      "type": "array",
      "minItems": 1,
      "items": {
        "type": "object",
        "additionalProperties": false,
        "required": [
          "url",
          "title",
          "retrieved"
        ],
        "properties": {
          "url": {
            "type": "string",
            "format": "uri",
            "pattern": "^https://"
          },
          "title": {
            "type": "string"
          },
          "retrieved": {
            "type": "string",
            "pattern": "^\\d{4}-\\d{2}-\\d{2}$"
          }
        }
      },
      "description": "Recipe-level bibliography. Presence proves neither source availability nor claim support; reviewers must verify both."
    },
    "verification": {
      "enum": [
        "doc-derived-unverified",
        "community-verified",
        "tenant-verified"
      ],
      "description": "doc-derived-unverified: researched from vendor docs, never exercised. community-verified: a shared teardown confirmed the main routes. tenant-verified: exercised end-to-end in a real teardown. Only promote with evidence."
    },
    "last_reviewed": {
      "type": "string",
      "pattern": "^\\d{4}-\\d{2}-\\d{2}$"
    },
    "notes": {
      "type": "string",
      "description": "anything that fits nowhere above; honest unknowns belong here. Describe the product and the documents, not the research session: constraints of the pass that produced the recipe go in research_caveats"
    },
    "research_caveats": {
      "type": "array",
      "items": {
        "type": "string",
        "minLength": 1
      },
      "description": "Constraints of the research pass that produced this recipe: vendor hosts that could not be fetched, exhausted search budgets, mirrors or source repositories read instead of live vendor pages, and which claims therefore rest on search-engine excerpts. These describe how the documents were consulted, not what they say. They are part of the recipe's provenance and must be preserved when a recipe is revised; they are removed only when a later pass consults the affected sources directly"
    }
  }
}
